Etapa 1,Codigo_1,Codigo_2,Codigo_3,Codigo_4,Codigo_5,Tema_1,Tema_2,Tema_3
"Não tenho uma melhoria, mas considero fundamental a reserva e dedicação de tempo durante o horário de trabalho para que as pessoas se dediquem ao desenvolvimento e aprendizado, tanto quanto a autonomia para encontrar a melhor forma que funciona para cada um, aliada a orientações que propiciem que as pessoas pratiquem no dia a dia",Pratica / Hands-on,Tempo dedicado,,,,Aplicabilidade prática e alinhamento às necessidades,Tempo e condicoes estruturais para aprendizagem,
"Desenvolvimento de habilidades multidisciplinares: Projetos exigem não só codificação, mas também comunicação, gestão de tempo, documentação e testes — habilidades essenciais no mercado.",Tempo dedicado,Didatica / Instrutor / Material,,,,Tempo e condicoes estruturais para aprendizagem,Qualidade pedagogica didatica e organizacao,
"Eu sugeriria integrar o aprendizado à rotina, com trocas regulares, mentorias e estudos de caso reais. Assim, o conhecimento não ficaria restrito a treinamentos pontuais, mas se tornaria parte do dia a dia dos",Pratica / Hands-on,Alinhamento / Personalizacao,Interacao / Mentoria,,,Aplicabilidade prática e alinhamento às necessidades,Interacao mentoria e troca social,
Processos de aprendizado mais focados em ganhos do nosso dia a dia,Pratica / Hands-on,,,,,Aplicabilidade prática e alinhamento às necessidades,,
Mais matérias em português,,,,,,,,
A Existência de incentivo maior por parte da empresa,Incentivo / Reconhecimento,,,,,Incentivos reconhecimento e apoio institucional,,
sempre ir de mente aberta e aprender tudo que puder,,,,,,,,
"Que os cursos sejam menos generalistas, pois o conteúdo é facilmente encontrado nos mecanismos de pesquisas gratuitos da internet e mais focados na atuação de cada área da empresa.",Didatica / Instrutor / Material,Incentivo / Reconhecimento,,,,Qualidade pedagogica didatica e organizacao,Incentivos reconhecimento e apoio institucional,
Mais apoio de pessoas mais experientes,Incentivo / Reconhecimento,Interacao / Mentoria,,,,Incentivos reconhecimento e apoio institucional,Interacao mentoria e troca social,
Não sei,,,,,,,,
"Ser mais prático, voltado a coisas do dia a dia do trabalho",Pratica / Hands-on,,,,,Aplicabilidade prática e alinhamento às necessidades,,
"Do meu ponto de vista e experiência empírica, a forma mais eficiente de aprendizado dentro de uma organização é a criação de um processo focado nos conhecimentos e habilidades necessários para o papel proposto, com acompanhamento, apoio e ajustes frequentes para possibilitar o desenvolvimento de todas as habilidades necessárias.",Didatica / Instrutor / Material,Incentivo / Reconhecimento,,,,Qualidade pedagogica didatica e organizacao,Incentivos reconhecimento e apoio institucional,
"Tempo dentro do expediente, reservado para este aprendizado.",Tempo dedicado,,,,,Tempo e condicoes estruturais para aprendizagem,,
"adequar o tempo de duração do curso com o conteúdo programado, pois inserir muito conteúdo para ser absorvido em curto prazo, sem revisão do assunto e aulas práticas gera frustração",Pratica / Hands-on,Tempo dedicado,Didatica / Instrutor / Material,Interacao / Mentoria,,Aplicabilidade prática e alinhamento às necessidades,Tempo e condicoes estruturais para aprendizagem,Qualidade pedagogica didatica e organizacao
"No processo era uma enxurrada de palestras simultâneas, o que deixa cansativo e fica difícil de acompanhar tudo.",Didatica / Instrutor / Material,,,,,Qualidade pedagogica didatica e organizacao,,
"Torná-los mais orientados a problemas reais do dia a dia de trabalho, ou a necessidades/dificuldades concretas do time como um todo.",Pratica / Hands-on,Alinhamento / Personalizacao,,,,Aplicabilidade prática e alinhamento às necessidades,,
não tenho,,,,,,,,
Ter professores capacitados,Didatica / Instrutor / Material,,,,,Qualidade pedagogica didatica e organizacao,,
Reduzir tempo de trabalho para adaptar o aprendizado,Tempo dedicado,,,,,Tempo e condicoes estruturais para aprendizagem,,
Aumentar a verba de capacitação.,Incentivo / Reconhecimento,,,,,Incentivos reconhecimento e apoio institucional,,
Conteúdos com respostas diretas as necessidades,Alinhamento / Personalizacao,Didatica / Instrutor / Material,,,,Aplicabilidade prática e alinhamento às necessidades,Qualidade pedagogica didatica e organizacao,
Ligar intimamente o PDI a progressão de carreira dentro da organização.,Alinhamento / Personalizacao,Didatica / Instrutor / Material,,,,Aplicabilidade prática e alinhamento às necessidades,Qualidade pedagogica didatica e organizacao,
Uma forma de pôr em prática logo próximo aos treinamentos.,Pratica / Hands-on,,,,,Aplicabilidade prática e alinhamento às necessidades,,
Mais prática,Pratica / Hands-on,,,,,Aplicabilidade prática e alinhamento às necessidades,,
Realizar os processos de aprendizado durante o período de expediente,Tempo dedicado,,,,,Tempo e condicoes estruturais para aprendizagem,,
"Na minha venture atual, não tenho nenhuma queixa, pois o conteúdo prende a atenção do começo ao fim, mesmo nos cursos obrigatórios.",Didatica / Instrutor / Material,,,,,Qualidade pedagogica didatica e organizacao,,
Líder lado a lado,Interacao / Mentoria,,,,,Interacao mentoria e troca social,,
"Muita aplicação pratica para todo conhecimento aprendido. Sempre deve ser explorada a prática, porque nem sempre todos os participantes estão no mesmo nível de conhecimento ou possuem compreensões diferentes. As experiências práticas aplicadas no treinamento os ajudam a nivelar todos. Além de tornar mais fácil o aprendizado.",Pratica / Hands-on,Didatica / Instrutor / Material,,,,Aplicabilidade prática e alinhamento às necessidades,Qualidade pedagogica didatica e organizacao,
Tirar cursos obrigatórios inúteis (compliance etc),,,,,,,,
Mais interação e envolvimento de todas as partes que vão participar do processo.,Interacao / Mentoria,,,,,Interacao mentoria e troca social,,
"O material de aprendizado na grande maioria dos casos é apenas um compliance para a emissão de algum certificado a nível empresarial. Pouco interessa se os trabalhadores extraíram algum conhecimento importante ou não. Não tenho ideias de como tornar processos de aprendizados empresariais úteis, porque na minha experiência, nunca houve u treinamento realment útil e personalizado para minha área de atuação.",Pratica / Hands-on,Alinhamento / Personalizacao,Didatica / Instrutor / Material,,,Aplicabilidade prática e alinhamento às necessidades,Qualidade pedagogica didatica e organizacao,
"Cursos mais objetivos, com materiais escritos que condizem com as aulas, ao invés de ofertar um material que não possui as informações das aulas, deve haver sinergia entre todas as fontes disponibilizadas.",Didatica / Instrutor / Material,,,,,Qualidade pedagogica didatica e organizacao,,
Mais laboratórios práticos.,Pratica / Hands-on,,,,,Aplicabilidade prática e alinhamento às necessidades,,
"O processo de aprendizagem deve ser mais mão na massa, mais prática e menos teoria.",Pratica / Hands-on,Didatica / Instrutor / Material,,,,Aplicabilidade prática e alinhamento às necessidades,Qualidade pedagogica didatica e organizacao,
Deveriam ser todos em formato de workshop hands on,Pratica / Hands-on,,,,,Aplicabilidade prática e alinhamento às necessidades,,
Mais hands on,Pratica / Hands-on,,,,,Aplicabilidade prática e alinhamento às necessidades,,
"Mais dinâmicas práticas, às vezes é mais teorias, conceitos.",Pratica / Hands-on,Didatica / Instrutor / Material,,,,Aplicabilidade prática e alinhamento às necessidades,Qualidade pedagogica didatica e organizacao,
Investir mais tempo em soft skills e atividade técnicas mais ligada ao dia a dia,Pratica / Hands-on,Tempo dedicado,,,,Aplicabilidade prática e alinhamento às necessidades,Tempo e condicoes estruturais para aprendizagem,
Serem pensadas dada um sólido plano de desenvolvimento de carreira. De maneira individualizada.,Alinhamento / Personalizacao,,,,,Aplicabilidade prática e alinhamento às necessidades,,
"Ter cursos que possam realmente ajudar nas atividades do trabalho. Não adianta ter cursos ou treinamentos que nao facam sentido para sua funcao atual. O processo de aprendizado tem que ser bem praticos, deixar a teoria um pouco de lado e partir logo para ""como fazer "".",Pratica / Hands-on,Didatica / Instrutor / Material,,,,Aplicabilidade prática e alinhamento às necessidades,Qualidade pedagogica didatica e organizacao,
Adotar o tipo de treinamento citado anteriormente.,,,,,,,,
A evolução dos metodos direcionados a linguagem de estudo com IA generativa,Didatica / Instrutor / Material,,,,,Qualidade pedagogica didatica e organizacao,,
"Em vez de obrigar todo mundo a fazer um curso cansativo, acho que agregaria fazer uma avaliação pra saber quem realmente precisa daquele curso. Quando não fazem isso, acabam exigindo que pessoas percam suas horas vendo um conteúdo que não agrega, pois já é conhecido e dominado.",Didatica / Instrutor / Material,,,,,Qualidade pedagogica didatica e organizacao,,
"Os instrutures que fazem projetos para avaliação do aluno, e também apresentam um projeto próprio de como eles fariam. É muito enriquecedor comparar com o trabalho do aluno com do professor e colegas de turma. Essas diferentes visões de trabalho ajuda ter muitas opções de melhoria no trabalho próprio do aluno",Didatica / Instrutor / Material,Interacao / Mentoria,,,,Qualidade pedagogica didatica e organizacao,Interacao mentoria e troca social,
"Uma experiência de aprendizado deve levar em conta as necessidades da empresa ou a possibilidade de inovação dentro do projeto atual. Sem utilidade direta, não há muito o que agregar dado que será um conhecimento que logo será esquecido. O que não quer dizer que ""pílulas"" de conhecimento não sejam interessantes, pois elas podem ajudar na criatividade - um novo conhecimento pode ser a porta para uma melhoria ou uma mudança de rota em um projeto.",Alinhamento / Personalizacao,,,,,Aplicabilidade prática e alinhamento às necessidades,,
"Customização de acordo com experiências, aprendizados e propósito de realizar a capacitação. Isso faria que os objetivos iniciais do aluno fossem atendidos de forma plena no final.",Alinhamento / Personalizacao,,,,,Aplicabilidade prática e alinhamento às necessidades,,
-,,,,,,,,
Acredito que o modelo ideal é ter menos treinamentos obrigatórios e uma ajuda de custo/reembolso para que o funcionário possa estudar sobre assuntos que ele tenha interesse e que esteja alinhado com os requisitos da empresa.,Alinhamento / Personalizacao,Incentivo / Reconhecimento,,,,Aplicabilidade prática e alinhamento às necessidades,Incentivos reconhecimento e apoio institucional,
Nenhum. Na empresa temos nosso tempo e ferramentas bem definidas.,Tempo dedicado,Incentivo / Reconhecimento,,,,Tempo e condicoes estruturais para aprendizagem,Incentivos reconhecimento e apoio institucional,
Mais hands-on competitivo,Pratica / Hands-on,,,,,Aplicabilidade prática e alinhamento às necessidades,,
"talvez antecipar informaçoes que nao estam disponiveis na experiencia, para conseguir ter uma melhor previsibilidade.",Interacao / Mentoria,,,,,Interacao mentoria e troca social,,
Trazer materiais de preparo antes do treinamento para nivelação e após o treinamento para ajudar a guiar os estudos.,Didatica / Instrutor / Material,,,,,Qualidade pedagogica didatica e organizacao,,
a empresa poderia liberar ao menos 2h por semana para treinamento.,Tempo dedicado,,,,,Tempo e condicoes estruturais para aprendizagem,,
"acho que atualmente poderiamos ter um modelo de IA que construisse cursos baseado e relacionados ao projeto que estamos trabalhando, sendo assim, teria um foco",,,,,,,,
"Eu sugeriria tornar os processos de aprendizado mais práticos e personalizados. Muitas vezes, o ensino é muito teórico e padronizado, o que faz com que nem todos aprendam de forma eficiente. Seria interessante incluir mais atividades que conectem o conteúdo à realidade, permitindo que cada pessoa aprenda no seu ritmo e de acordo com seus interesses e estilo de aprendizagem.",Pratica / Hands-on,Alinhamento / Personalizacao,Didatica / Instrutor / Material,,,Aplicabilidade prática e alinhamento às necessidades,Qualidade pedagogica didatica e organizacao,
Validações de aprendizado,Didatica / Instrutor / Material,,,,,Qualidade pedagogica didatica e organizacao,,
"Considerando que a grande maioria dos treinamentos é EAD, creio que a padronização de áudio e vídeo entre os professores é importante. Ademais, as coordenações dos cursos deveriam avaliar previamente as atividades sugeridas, a fim de verificar se estão bem redigidas e se fazem sentido em relação ao conteúdo programático do curso, ao invés de apenas “confiar” nos professores.",Didatica / Instrutor / Material,,,,,Qualidade pedagogica didatica e organizacao,,
"Não sei como resolver, mas entender que cada aluno tem uma jornada e um tempo diferente ara fixar o conteúdo.",Tempo dedicado,Didatica / Instrutor / Material,,,,Tempo e condicoes estruturais para aprendizagem,Qualidade pedagogica didatica e organizacao,
"Aprendizados tangíveis que não ficam apenas na teoria, mas tem algo prático ou material",Pratica / Hands-on,Didatica / Instrutor / Material,,,,Aplicabilidade prática e alinhamento às necessidades,Qualidade pedagogica didatica e organizacao,
"Tempo para os estudos, principalmente quando é alguma certificação obrigatória!",Tempo dedicado,,,,,Tempo e condicoes estruturais para aprendizagem,,
Um foco maior em conectar o conhecimento teórico com a prática do dia a dia,Pratica / Hands-on,,,,,Aplicabilidade prática e alinhamento às necessidades,,
"Equilibrar teoria, pratica. Nao ser conteudo muito denso",Pratica / Hands-on,Didatica / Instrutor / Material,,,,Aplicabilidade prática e alinhamento às necessidades,Qualidade pedagogica didatica e organizacao,
Classe invertida,Didatica / Instrutor / Material,,,,,Qualidade pedagogica didatica e organizacao,,
"Considerar interações após o treinamento, aliando conteúdo com troca de experiências.",Didatica / Instrutor / Material,Interacao / Mentoria,,,,Qualidade pedagogica didatica e organizacao,Interacao mentoria e troca social,
Maior organização de cronograma e escolha de um horário de participação mais acessível.,Tempo dedicado,Alinhamento / Personalizacao,Didatica / Instrutor / Material,,,Tempo e condicoes estruturais para aprendizagem,Aplicabilidade prática e alinhamento às necessidades,Qualidade pedagogica didatica e organizacao
"Se eu pudesse sugerir uma melhoria nos processos de aprendizado, seria tornar o aprendizado mais conectado a problemas reais de engenharia. Muitas vezes, o foco está em absorver conceitos de forma teórica, mas o verdadeiro ganho vem quando aplicamos esses conceitos em contextos reais — lidando com limitações, decisões de trade-off e impactos em produção. Defendo um modelo de aprendizado mais baseado em experimentação, onde o desenvolvedor é incentivado a explorar, errar e refletir sobre o resultado. Por exemplo, entender por que uma implementação de consumo de eventos falhou em garantir idempotência é muito mais valioso do que apenas saber o que é idempotência em teoria. Além disso, acredito que o aprendizado deveria ser contínuo e contextual, com mentorias técnicas que ajudem a traduzir boas práticas em soluções aplicáveis ao dia a dia da equipe. Aprender com o código em produção, com revisões bem fundamentadas e com discussões de arquitetura, cria um ciclo muito mais sólido e duradouro de evolução técnica.",Pratica / Hands-on,Alinhamento / Personalizacao,Didatica / Instrutor / Material,Incentivo / Reconhecimento,Interacao / Mentoria,Aplicabilidade prática e alinhamento às necessidades,Qualidade pedagogica didatica e organizacao,
"Montar uma documentação para orientar o aprendizado é sempre útil, pois dá clareza sobre o caminho a seguir. Aprender “no escuro” tem seu valor, mas contar com um guia torna o processo muito mais eficiente.",Didatica / Instrutor / Material,,,,,Qualidade pedagogica didatica e organizacao,,
Material de Apoio,Didatica / Instrutor / Material,Incentivo / Reconhecimento,,,,Qualidade pedagogica didatica e organizacao,Incentivos reconhecimento e apoio institucional,
Ter conteúdos mais curtos,Didatica / Instrutor / Material,,,,,Qualidade pedagogica didatica e organizacao,,
"Pensando nas empresas, seria bom que elas liberassem e incentivassem o aprendizado como parte da jornada de trabalho.",Incentivo / Reconhecimento,,,,,Incentivos reconhecimento e apoio institucional,,
Menos custo financeiro,,,,,,,,